A;Flextronics International GmbH;"Flextronics zählt zu den weltweit größten Auftragsproduzenten in der Fertigung elektronischer Baugruppen (Electronic Manufacturing Service). Der Produktions- und Entwicklungsstandort in Althofen ist als europäisches
Kompetenzzentrum weltweit für das Know-how seiner Mitarbeiter bekannt.";Gerda Reif;Friesacher Straße 3, 9330 Althofen;04262/2644-1159;www.flextronics.com;gerda.reif@flextronics.com;Elektro- und Elektronikindustrie;weltweit, Österreich: Althofen und Wien;ca. 700;20–25;;;Design, Engineering, IT/IS, Produktion, Logistik, Medizintechnik, Marketing;;54;flextronics;gerda_reif
A;AVS - Arbeitsvereinigung der Sozialhilfe Kärntens;Die AVS ist mit rund 1400 Beschäftigten größter Anbieter sozialer Dienstleistungen in Kärnten. Zu unseren Fachbereichen zählen die Krankenpflege, die Pädagogik, die Physiotherapie – Ergotherapie – Logopädie, die Psychologie/Psychotherapie und andere Fachdisziplinen. Dadurch ermöglichen wir die Beratung, Betreuung, Förderung, Pflege und Therapie von Menschen aller Altersgruppen.;Dir. Klaus Harter (Geschäftsführer);Fischlstraße 40, 9024 Klagenfurt;0463/512035-112;www.avs-sozial.at;office@avs-sozial.at;Sozial- und Gesundheitsbereich;Klagenfurt, Villach, Feldkirchen, Hermagor, Kraig, Spittal/Drau, St. Andrä, St. Kanzian, St. Paul im Lavanttal, St. Stefan/Gailtal, St. Veit, Völkermarkt, Sittersdorf, Wolfsberg, Techelsberg;in Kärnten rund 1400;Dipl. Pflegepersonal, Pflegehelfer, Fachsozialbetreuer BB;;;Mobiler und Stationärer Bereich der Pflege, Behindertenbereich;;53;avs;klaus_harter
C;Job Shadowing;Beim Job Shadowing haben Studierende der Alpen-Adria-Universität Klagenfurt die Gelegenheit, einen Tag lang einer berufstätigen Person (vorrangig AbsolventIn der AAU) über die Schulter zu schauen und damit Einblicke in interessante Berufsfelder zu gewinnen und wertvolle Kontakte zu knüpfen. Wählen Sie ein MentorInnen-Profil aus und schicken Sie Ihren Lebenslauf & 5-10 Motivationszeilen an karriere@aau.at. Bewerbungsfrist: 04. Dezember 2014. Der/Die MentorIn vereinbart mit dem geeigneten Kandidaten/der geeigneten Kandidaten einen Termin für den Job Shadowing-Tag.;Johanna Ortner;Universitätsstraße 65-67, 9020 Klagenfurt;0463/2700-9313;www.aau.at/karriere/jobshadowing;karriere@aau.at;;;;;;;;;51;job_shadowing;none
C;Karriere & Alumni: Alpen-Adria-Universität Klagenfurt;Karriere & Alumni bietet Studierenden sowie AbsolventInnen und Unternehmen Serviceleistungen zu karrierebezogenen Themen an.;Roswitha Jost, Johanna Ortner;Universitätsstraße 65-67, 9020 Klagenfurt;0463/2700-9317, 0463/2700-9313;www.aau.at/karriere-und-alumni;karriere@aau.at;;;;;;;;;6;alumni;none
C;Information & Support;Bei Fragen zur connect 2014 steht ihnen am Infopoint eine kompetente Ansprechperson zur Verfügung.;;;;www.aau.at/connect;;;;;;;;;;1;information;none
